date	id	username	text	opponent_mentioned
2020-03-14	1238626530361847810	RealDonaldTrump	....the Secretary of the Treasury and the Secretary of Labor to issue regulations that will provide flexibility so that in no way will Small Businesses be hurt. I encourage all Republicans and Democrats to come together and VOTE YES! I will always put....	False
2020-03-14	1238626531510976512	RealDonaldTrump	....the health and well-being of American families FIRST. Look forward to signing the final Bill, ASAP!	False
2020-03-14	1238626501555298308	RealDonaldTrump	I fully support H.R. 6201: Families First CoronaVirus Response Act, which will be voted on in the House this evening. This Bill will follow my direction for free CoronaVirus tests, and paid sick leave for our impacted American workers. I have directed....	False
2020-03-13	1238603402457812992	RealDonaldTrump	Americans are the strongest and most resilient people on earth...We will remove or eliminate every obstacle necessary to deliver our people the care that they need, and that they are entitled to. No resource will be spared. 	False
2020-03-13	1238599373417787394	RealDonaldTrump	....No matter where you may be, I encourage you to turn towards prayer in an act of faith. Together, we will easily PREVAIL!	False
2020-03-13	1238599369466753026	RealDonaldTrump	It is my great honor to declare Sunday, March 15th as a National Day of Prayer. We are a Country that, throughout our history, has looked to God for protection and strength in times like these....	False
2020-03-13	1238590988593086464	RealDonaldTrump	At my request, effective midnight tonight, Carnival, Royal Caribbean, Norwegian, and MSC have all agreed to suspend outbound cruises for thirty days. It is a great and important industry – it will be kept that way!	False
2020-03-13	1238575476916006915	RealDonaldTrump	We will remove or eliminate every obstacle necessary to deliver our people the care they need. No resource will be spared! 	False
2020-03-13	1238570595710836738	RealDonaldTrump	To unleash the full power of the Federal Government in this effort, today I am officially declaring a National Emergency. 	False
2020-03-13	1238478818135945216	RealDonaldTrump	I will be having a news conference today at 3:00 P.M., The White House. Topic: CoronaVirus!	False
2020-03-13	1238478167695863817	RealDonaldTrump	To this point, and because we have had a very strong border policy, we have had 40 deaths related to CoronaVirus. If we had weak or open borders, that number would be many times higher!	False
2020-03-13	1238460927328075778	RealDonaldTrump	The Federal Reserve must FINALLY lower the Fed Rate to something comparable to their competitor Central Banks. Jay Powell and group are putting us at a decided economic &amp; physiological disadvantage. Should never have been this way. Also, STIMULATE!	False
2020-03-13	1238442385048305664	RealDonaldTrump	If you want to get money into the hands of people quickly &amp; efficiently, let them have the full money that they earned, APPROVE A PAYROLL TAX CUT until the end of the year, December 31. Then you are doing something that is really meaningful. Only that will make a big difference!	False
2020-03-13	1238410051758575617	RealDonaldTrump	.... Their response to H1N1 Swine Flu was a full scale disaster, with thousands dying, and nothing meaningful done to fix the testing problem, until now. The changes have been made and testing will soon happen on a very large scale basis. All Red Tape has been cut, ready to go!	False
2020-03-13	1238410044263333894	RealDonaldTrump	For decades the @CDCgov looked at, and studied,  its testing system, but did nothing about it. It would always be inadequate and slow for a large scale pandemic, but a pandemic would never happen, they hoped. President Obama made changes that only complicated things further.....	False
2020-03-13	1238292145242603522	RealDonaldTrump	“The Obama White House had to immediately issue an apology for Joe Biden’s remarks, and any alarm that he might have caused, an alarm about a Swine Flu outbreak that took 6 months for President Obama to declare a National Emergency, and that killed 12,000 Americans.” @LouDobbs	True
2020-03-13	1238288908431036423	RealDonaldTrump	Sleepy Joe Biden was in charge of the H1N1 Swine Flu epidemic which killed thousands of people. The response was one of the worst on record. Our response is one of the best, with fast action of border closings &amp; a 78% Approval Rating, the highest on record. His was lowest!	True
2020-03-13	1238283146350809088	RealDonaldTrump	Just had a great conversation with Prime Minister Abe of Japan. I told him that the just completed Olympic venue is magnificent. He has done an incredible job, one that will make him very proud. Good things will happen for Japan and their great Prime Minister. Lots of options!	False
2020-03-12	1238193633825882113	RealDonaldTrump	108 countries are dealing with the CoronaVirus problem, some of which we are helping!	False
2020-03-12	1238163357049511937	RealDonaldTrump	KEEPING THE WORKPLACE SAFE, ENCOURAGE YOUR EMPLOYEES TO.... 	False
2020-03-12	1238163344902799364	RealDonaldTrump	KEEPING COMMERCIAL ESTABLISHMENTS SAFE, ENCOURAGE YOUR EMPLOYEES AND CUSTOMERS TO.... 	False
2020-03-12	1238163334412881920	RealDonaldTrump	KEEPING THE SCHOOL SAFE, ENCOURAGE YOUR FACULTY, STAFF, AND STUDENTS TO.... 	False
2020-03-12	1238163326372364289	RealDonaldTrump	KEEPING THE HOME SAFE, ENCOURAGE YOUR FAMILY MEMBERS TO.... 	False
2020-03-12	1238113667754995712	RealDonaldTrump	Many Republican Senators want me to Veto the FISA Bill until we find out what led to, and happened with, the illegal attempted “coup” of the duly elected President of the United States, and others!	False
2020-03-12	1238046001744826369	RealDonaldTrump	“Nancy Pelosi all of a sudden doesn’t like the payroll tax cut, but when Obama proposed it she thought it was a brilliant thing that all of the working families would benefit from because if you get a paycheck, you’re going to take home more money.” @kilmeade @foxandfriends	False
2020-03-12	1237924658185469954	RealDonaldTrump	Hoping to get the payroll tax cut approved by both Republicans and Democrats, and please remember, very important for all countries &amp; businesses to know that trade will in no way be affected by the 30-day restriction on travel from Europe. The restriction stops people not goods.	False
2020-03-12	1237924069397467137	RealDonaldTrump		False
2020-03-11	1237861968721010689	RealDonaldTrump	The Media should view this as a time of unity and strength. We have a common enemy, actually, an enemy of the World, the CoronaVirus. We must beat it as quickly and safely as possible. There is nothing more important to me than the life &amp; safety of the United States!	False
2020-03-11	1237841878889840642	RealDonaldTrump	I will be addressing the Nation this evening at 9:00 P.M. (Eastern) from the Oval Office.	False
2020-03-11	1237820230296010752	RealDonaldTrump	I am fully prepared to use the full power of the Federal Government to deal with our current challenge of the CoronaVirus!	False
2020-03-11	1237820042735226887	RealDonaldTrump	I want to thank all of our Great Government officials on the CoronaVirus Task Force who are working around the clock, in response to the CoronaVirus. Continue to check  for updates, and follow all recommendations that are available....	False
2020-03-11	1237820044198977536	RealDonaldTrump	....We have the greatest healthcare system, experts, scientists and doctors anywhere in the world. Together, we will PREVAIL!	False
2020-03-11	1237813728558678026	RealDonaldTrump	....Together we are putting into policy a plan to prevent, detect, treat and create a vaccine against CoronaVirus to save lives in America and the world. America will get it done!	False
2020-03-11	1237813727409229824	RealDonaldTrump	America is the Greatest Country in the world. We have the best scientists, doctors, nurses and health care professionals. They are amazing people who do phenomenal things every day....	False
2020-03-11	1237813081394348034	RealDonaldTrump	Someone needs to tell the Democrats in Congress that CoronaVirus doesn’t care what party you are in. We need to protect ALL Americans!	False
2020-03-11	1237745593876873217	RealDonaldTrump	Vanity Fair Magazine, which will soon be out of business, and their third rate Fake reporters, who make up sources which don’t exist, wrote yet another phony &amp; boring hit piece. The facts are just the opposite. Our team is doing a great job with CoronaVirus!	False
2020-03-11	1237742116564013056	RealDonaldTrump	Thank you Gavin. Team is doing a great job! 	False
2020-03-11	1237612361353007104	RealDonaldTrump	THANK YOU IDAHO! #KAG2020 	False
2020-03-11	1237603152490147850	RealDonaldTrump	Pocahontas, working in conjunction with the Democrat Party, totally destroyed the campaign of Bernie Sanders. If she would have quit 3 days earlier, Sanders would have beaten Biden in a route, it wouldn’t even have been close. They also got two other losers to support Sleepy Joe!	True
2020-03-11	1237581053373497344	RealDonaldTrump	THANK YOU WASHINGTON! #KAG2020 	False
2020-03-11	1237580932472692736	RealDonaldTrump	THANK YOU NORTH DAKOTA! #KAG2020 	False
2020-03-11	1237557412048986120	RealDonaldTrump	....(which is under siege), is strong on Crime and the Border, and truly LOVES our Military and our Vets. He will be a great Senator for the people of Alabama. Coach Tommy Tuberville, a winner, has my Complete and Total Endorsement. I love Alabama!	False
2020-03-11	1237557409943416834	RealDonaldTrump	Tommy Tuberville (@TTuberville) is running for the U.S. Senate from the Great State of Alabama. Tommy was a terrific head football coach at Auburn University. He is a REAL LEADER who will never let MAGA/KAG, or our Country, down! Tommy will protect your Second Amendment....	False
2020-03-11	1237545548430770178	RealDonaldTrump	THANK YOU MICHIGAN! #KAG2020 	False
2020-03-11	1237542616813539328	RealDonaldTrump	THANK YOU MISSOURI! #KAG2020 	False
2020-03-11	1237541916398325761	RealDonaldTrump	THANK YOU MISSISSIPPI! #KAG2020 	False
2020-03-10	1237498359134466051	RealDonaldTrump	Best unemployment numbers in the history of our Country. Best employment number EVER, almost 160 million people working right now. Vote Republican, unless you want to see these numbers obliterated!	False
2020-03-10	1237491395436240897	RealDonaldTrump	If you like automobiles, how can you vote for a Democrat who all want to get rid of cars, as quickly as possible, especially if they are powered by gasoline. Remember also, no more than one car per family. I, on the other hand, have new plants being built all over Michigan, Plus!	False
2020-03-10	1237490722317746178	RealDonaldTrump	If you like automobils, how can you vote for a Democrat who all want to get rid of cars, as quickly as possible, especially if they are powered by gasoline. Remember also, no more than one car per family. I, on the other hand, have new plants being built all over Michigan, Plus!	False
2020-03-10	1237448419284783105	RealDonaldTrump	Great meeting on Capitol Hill with the @SenateGOP! 	False
2020-03-10	1237419080707170311	RealDonaldTrump	Thank you @SenateGOP! 	False
2020-03-10	1237389825520648192	RealDonaldTrump	Ronald Reagan’s great economist, the recipient of the Presidential Medal of Freedom, has just said great things about a Payroll Tax Cut!	False
2020-03-10	1237388788776800256	RealDonaldTrump	Our CoronaVirus Team has been doing a great job. Even Democrat governors have been VERY complimentary!	False
2020-03-10	1237388340778782725	RealDonaldTrump	Nancy Pelosi just said, “I don’t know if we can be ready this week.” In other words, it’s off to vacation for the Do Nothing Democrats. That’s been the story with them for 1 1/2 years!	False
2020-03-10	1237384954004340738	RealDonaldTrump	There is another Russia, Russia, Russia meeting today. It is headed up by corrupt politician Adam “Shifty” Schiff, so I wouldn’t expect too much! @DHS_Wolf	False
2020-03-10	1237378225417961472	RealDonaldTrump	The Federal Reserve must be a leader, not a very late follower, which it has been!	False
2020-03-10	1237377697917140992	RealDonaldTrump	Our pathetic, slow moving Federal Reserve, headed by Jay Powell, who raised rates too fast and lowered too late, should get our Fed Rate down to the levels of our competitor nations. They now have as much as a two point advantage, with even bigger currency help. Also, stimulate!	False
2020-03-10	1237374729545228288	RealDonaldTrump	Well deserved Jack. A great honor! 	False
2020-03-10	1237374208314834946	RealDonaldTrump	True, with number 1 being more important! 	False
2020-03-10	1237368448533004288	RealDonaldTrump	Going to be a BAD day for Crazy Bernie!	False
2020-03-10	1237341582145105920	RealDonaldTrump	Polls say they BOTH lose to “Trump”. 	False
2020-03-10	1237340894610759680	RealDonaldTrump	Wow! @foxandfriends blew away the competition of Morning Joke (which did very poorly) on MSDNC (Another Comcast sleaze production), and @CNN’s New Day, in the Morning Television Ratings. A total blowout, but that’s what you get when you treat “Trump” fairly!	False
2020-03-10	1237334397172490240	RealDonaldTrump	Going up fast. We need the Wall more than ever! 	False
2020-03-10	1237239192222158848	RealDonaldTrump	Fake News!! 	False
2020-03-10	1237236320935849985	RealDonaldTrump	Oklahoma, Vote for your GREAT Senator Today. Nobody better than Jim! 	False
2020-03-09	1237130072571731968	RealDonaldTrump	THANK YOU, Jim, for your incredible support of our #MAGA Agenda! You are a tremendous Senator for the people of the Great State of Oklahoma and you have my Complete and Total Endorsement! 	False
2020-03-09	1237129690877476864	RealDonaldTrump	Congressman @StevenPalazzo is doing a fantastic job for the people of Mississippi. He strongly supports our #MAGA Agenda. Steven will continue to protect your #2A, &amp; Support our INCREDIBLE Vets &amp; Military. Steven has my Complete Endorsement. VOTE for Steven tomorrow, March 10th!	False
2020-03-09	1237128422712905738	RealDonaldTrump	Congressman Michael Guest (@GuestCongress) is an incredible fighter for the Great State of Mississippi. Michael is strong on Crime and the Border, he loves our Military and Vets. Michael has my Complete and Total Endorsement! Get out and Vote for Michael tomorrow, March 10th!	False
2020-03-09	1237027356314869761	RealDonaldTrump	So last year 37,000 Americans died from the common Flu. It averages between 27,000 and 70,000 per year. Nothing is shut down, life &amp; the economy go on. At this moment there are 546 confirmed cases of CoronaVirus, with 22 deaths. Think about that!	False
2020-03-09	1237024551294382081	RealDonaldTrump	Saudi Arabia and Russia are arguing over the price and flow of oil. That, and the Fake News, is the reason for the market drop!	False
2020-03-09	1237024549046288385	RealDonaldTrump	Good for the consumer, gasoline prices coming down!	False
2020-03-09	1237004509156642816	RealDonaldTrump	So much FAKE NEWS!	False
2020-03-09	1237004230847868929	RealDonaldTrump	The BEST decision made was the toughest of them all - which saved many lives. Our VERY early decision to stop travel to and from certain parts of the world!	False
2020-03-09	1237003145743605761	RealDonaldTrump	Great job being done by the @VP and the CoronaVirus Task Force. Thank you!	False
2020-03-09	1236980284744241154	RealDonaldTrump	The Obama/Biden Administration is the most corrupt Administration in the history of our Country!	True
2020-03-09	1236979946175725568	RealDonaldTrump	“Trump has outmastered the Deep State. He’s light years ahead of us.” MSDNC. I disagree. We have a long way to go. There are still some very bad, sick people in our government - people who do not love our Country (In fact, they hate our Country!).	False
2020-03-09	1236978443042148352	RealDonaldTrump	Now the Democrats are trying to smear Bernie with Russia, Russia, Russia. They are driving him Crazy!	False
2020-03-09	1236977607062761472	RealDonaldTrump	Elizabeth “Pocahontas” Warren singlehandedly destroyed the Bernie Sanders campaign by stripping voters away from his count on Super T. He lost states that he easily would have won if she had dropped out 3 days earlier. The DNC is doing it to Bernie again! Will he ever get angry?	False
2020-03-09	1236976241305169921	RealDonaldTrump	Cryin’ Chuck Schumer said, “You will pay the price for this. You won’t know what HIT YOU.” That is far beyond simple rhetoric. That is a physical threat, or at least a threat that you better vote for us.” Trouble ahead!	False
2020-03-09	1236975196642390022	RealDonaldTrump	The Fake News Media and their partner, the Democrat Party, is doing everything within its semi-considerable power (it used to be greater!) to inflame the CoronaVirus situation, far beyond what the facts would warrant. Surgeon General, “The risk is low to the average American.”	False
2020-03-09	1236972698313666565	RealDonaldTrump	A great book, support Charlie, BUY IT!  Already Number One. 	False
2020-03-09	1236959207917858819	RealDonaldTrump	Working hard Lori! 	False
2020-03-09	1236885723946631173	RealDonaldTrump	There are no mixed messages, only political weaponization by people like you and your brother, Fredo! 	False
2020-03-08	1236778368533700609	RealDonaldTrump	Who knows what this means, but it sounds good to me! 	False
2020-03-08	1236689044366557184	RealDonaldTrump	The New York Times is an embarrassment to journalism. They were a dead paper before I went into politics, and they will be a dead paper after I leave, which will be in 5 years. Fake News is the Enemy of the people!	False
2020-03-08	1236634209516752896	RealDonaldTrump	We have a perfectly coordinated and fine tuned plan at the White House for our attack on CoronaVirus. We moved VERY early to close borders to certain areas, which was a Godsend. V.P. is doing a great job. The Fake News Media is doing everything possible to make us look bad. Sad!	False
2020-03-08	1236523073689567234	RealDonaldTrump	Thank you @SenatorTimScott! 	False
2020-03-08	1236512502210613249	RealDonaldTrump	.....least 5 States &amp; the Nomination. Did the DNC &amp; Dems tell Elizabeth Warren to wait? If so, they were deadly, the race would have been over, &amp; Bernie would have won. Dirty double dealing? Nobody knows for sure, &amp; history will be the judge. But I say, here we go AGAIN, Bernie!	False
2020-03-08	1236512499563999234	RealDonaldTrump	We have now learned for sure that the Democrats don’t want anything to do with Crazy Bernie. Rigged? First @amyklobuchar &amp; @PeteButtigieg quit the race &amp; come out for Sleepy Joe BEFORE Super Tuesday. Pocahontas says NO &amp; quits race AFTER ELECTION, thereby depriving Bernie of at..	True
2020-03-08	1236501057192316928	RealDonaldTrump	I agree with Joe! 	True
2020-03-08	1236498759670009857	RealDonaldTrump	Thank you to the Great State of Tennessee. We are with you all the way! 	False
2020-03-07	1236135907201294336	RealDonaldTrump	Thank you @GovBillLee and @MariaLeeTN. My Administration will always be there for the Great People of Tennessee. Together, we will prevail!  	False
2020-03-07	1236096307858681857	RealDonaldTrump	....I want to thank Acting Chief Mick Mulvaney for having served the Administration so well. He will become the United States Special Envoy for Northern Ireland. Thank you!	False
2020-03-07	1236096307103707136	RealDonaldTrump	I am pleased to announce that Congressman Mark Meadows will become White House Chief of Staff. I have long known and worked with Mark, and the relationship is a very good one....	False
2020-03-07	1236083901673570304	RealDonaldTrump	Congratulations to @FoxNews!  	False
2020-03-06	1236039213486927872	RealDonaldTrump		False
2020-03-06	1236038573087961088	RealDonaldTrump	Thank you @GovBillLee. We are a phone call away, and here for you! 	False
2020-03-06	1236033562425659396	RealDonaldTrump	My Administration is with you all of the way, Tennessee. We love you!  	False
2020-03-06	1235955288064135168	RealDonaldTrump	Spoke to Governor @GavinNewsom early this morning about the cruise ship quarantined off the California Coast. CoronaVirus test kits have been delivered, testing is taking place now. 	False
2020-03-06	1235952805581447173	RealDonaldTrump	It is FAKE NEWS that @HHSGov @SecAzar is “sidelined” from the great job he is doing on the CoronaVirus Task Force. He has the total confidence of the @VP and myself, and is doing a fantastic job, as the numbers would indicate!	False
2020-03-06	1235945259370041344	RealDonaldTrump	I will protect your Social Security and Medicare, just as I have for the past 3 years. Sleepy Joe Biden will destroy both in very short order, and he won’t even know he’s doing it!	True
2020-03-06	1235944077188665344	RealDonaldTrump	 	False
2020-03-06	1235933477092159489	RealDonaldTrump	JOBS, JOBS, JOBS!!!  	False
2020-03-06	1235797615041753088	RealDonaldTrump	Thanks Linda, but they were really good last night! 	False
2020-03-06	1235796153981075456	RealDonaldTrump	Thank you! 	False
2020-03-06	1235774524295131136	RealDonaldTrump	My great honor! 	False
2020-03-06	1235770412275032064	RealDonaldTrump	Thank you Audrey! 	False
2020-03-06	1235768913692065792	RealDonaldTrump	The WALL is well under construction. So far we’re up to 129 miles, and by early next year we will have 500 miles completed! 	False
2020-03-06	1235766710038298625	RealDonaldTrump	We have appointed 220 Federal Judges and two Supreme Court Justices. PROMISES MADE, PROMISES KEPT! 	False
2020-03-06	1235765896934821894	RealDonaldTrump	Thank you David, a lifelong Democrat from Pennsylvania. We will continue MAKING AMERICA GREAT AGAIN and then, KEEP AMERICA GREAT!!!! 	False
2020-03-06	1235748252185739264	RealDonaldTrump	Thank you Scranton, Pennsylvania. It was a great evening! 	False
2020-03-06	1235746729770848256	RealDonaldTrump	Tonight’s Fox News Town Hall with @MarthaMacCallum and @BretBaier will rebroadcast at 11:00 P.M. Eastern on @FoxNews. Enjoy!	False
2020-03-05	1235665981709709319	RealDonaldTrump	Thank you Nan! 	False
2020-03-05	1235665090432708608	RealDonaldTrump	Gallup just gave us the highest rating ever for the way we are handling the CoronaVirus situation. The April 2009-10 Swine Flu, where nearly 13,000 people died in the U.S., was poorly handled. Ask MSDNC &amp; lightweight Washington failure @RonaldKlain, who the President was then?	False
2020-03-05	1235641895772139523	RealDonaldTrump	The Department of Education is NOT closing hundreds of schools in rural areas of our Country. This is just more Fake News. We are investing greatly in our schools, and always will!	False
2020-03-05	1235633381595066373	RealDonaldTrump	Mini Mike, you’re easy!  	False
2020-03-05	1235604572850343937	RealDonaldTrump	With approximately 100,000 CoronaVirus cases worldwide, and 3,280 deaths, the United States, because of quick action on closing our borders, has, as of now, only 129 cases (40 Americans brought in) and 11 deaths. We are working very hard to keep these numbers as low as possible!	False
2020-03-05	1235601483367923718	RealDonaldTrump	“Joe Biden represents the past. President Trump represents the future.” @LisaMarieBoothe @edhenry @FoxNews	True
2020-03-05	1235598653114511360	RealDonaldTrump	Elizabeth “Pocahontas” Warren, who was going nowhere except into Mini Mike’s head, just dropped out of the Democrat Primary...THREE DAYS TOO LATE. She cost Crazy Bernie, at least, Massachusetts, Minnesota and Texas. Probably cost him the nomination! Came in third in Mass.	False
2020-03-05	1235596612099084288	RealDonaldTrump	.@GOPLeader Kevin McCarthy informed me that I was 20 for 20 on Tuesday with respect to my Endorsement of candidates. Sadly, I didn’t get that information from the Fake News Media. They don’t report those things, or the far more than Dems cumulative votes, despite no opposition!	False
2020-03-05	1235594306297253889	RealDonaldTrump	“I want to commend the President for how he has handled the CoronaVirus situation, especially his early decision to shut down access into our Country from China, despite strong opposition to that decision.” @SenTomCotton Thank you Tom!	False
2020-03-05	1235588587690676224	RealDonaldTrump	Schumer has brought great danger to the steps of the United States Supreme Court!	False
2020-03-05	1235573492004904961	RealDonaldTrump	I NEVER said people that are feeling sick should go to work. This is just more Fake News and disinformation put out by the Democrats, in particular MSDNC. Comcast covers the CoronaVirus situation horribly, only looking to do harm to the incredible &amp; successful effort being made!	False
2020-03-05	1235568602696355840	RealDonaldTrump	As per recent Federal Court ruling, the Federal Government will be withholding funds from Sanctuary Cities. They should change their status and go non-Sanctuary. Do not protect criminals!	False
2020-03-05	1235418846758088704	RealDonaldTrump		False
2020-03-05	1235415690292662273	RealDonaldTrump		False
2020-03-05	1235385447813197831	RealDonaldTrump	I will be interviewed by @seanhannity on @FoxNews at 9:10 P.M.	False
2020-03-05	1235375346494644224	RealDonaldTrump	Retired Four Star General Jack Keane will receive the PRESIDENTIAL MEDAL OF FREEDOM next week!	False
2020-03-05	1235370217712300038	RealDonaldTrump	There can be few things worse in a civilized, law abiding nation, than a United States Senator openly, and for all to see and hear, threatening the Supreme Court or its Justices. This is what Chuck Schumer just did. He must pay a severe price for this!	False
2020-03-05	1235362601351118851	RealDonaldTrump	Retired Four Star General Jack Keane will recieve the PRESIDENTIAL MEDAL OF FREEDOM next week!	False
2020-03-05	1235359627082117120	RealDonaldTrump	This is a direct &amp; dangerous threat to the U.S. Supreme Court by Schumer. If a Republican did this, he or she would be arrested, or impeached. Serious action MUST be taken NOW! 	False
