date	id	username	text	opponent_mentioned
2020-08-13	1293860654626078721	RealDonaldTrump	I will be interviewed by @MariaBartiromo on @FoxBusiness this morning at 7:30. A.M. Enjoy!	False
2020-08-13	1293722878882598914	RealDonaldTrump		False
2020-08-12	1293619734894837760	RealDonaldTrump	I am sending $15M from @USDOT to beautiful North Dakota! This federal funding will support bus service for people from Bismarck to Grand Forks and several other areas statewide. Congratulations!	False
2020-08-12	1293619626681737219	RealDonaldTrump	Congrats to Colorado who will be receiving $14.9M in federal infrastructure funds from @USDOT. Happy to support bus service for residents throughout this great state!	False
2020-08-12	1293619360762925057	RealDonaldTrump	Honored to send $25.9 MILLION in @USDOT funds to the great State of Texas to support bus infrastructure improvements. Congratulations to the MANY Texans who will benefit!	False
2020-08-12	1293619293628829696	RealDonaldTrump	Big news for Wisconsin! @USDOT is awarding $7.7M in federal infrastructure funds to support bus service for the people of Madison and Milwaukee County!	False
2020-08-12	1293619264973414401	RealDonaldTrump	Good news for Florida! I’m awarding $27.8M from @USDOT in federal infrastructure funds to five areas including Orlando, Jacksonville, Ft. Myers/Naples, St. Petersburg, and Tampa. Happy to support bus service for the people in beautiful Florida!	False
2020-08-12	1293619226020806659	RealDonaldTrump	Georgia will be receiving $13M in federal infrastructure funds from @USDOT. BIG investment in bus facilities for people in metro Atlanta – must keep people moving safely! @MARTASERVICE	False
2020-08-12	1293619197096927232	RealDonaldTrump	Big improvements in rural bus service will be on their way to Michigan! I am awarding $27.8M in federal funding through @USDOT to improve bus service statewide. SO important for transit in this great state!	False
2020-08-12	1293619155422400512	RealDonaldTrump	Sending $8.3M in @USDOT funding to North Carolina for bus and bus facility improvements in Asheville, Fayetteville, and Chapel Hill. Glad to support bus service in these areas!	False
2020-08-12	1293619129354801163	RealDonaldTrump	New Hampshire will receive nearly $822K in @USDOT funds for bus service in the city of Nashua. Happy to support @RideBigBlue and keep the people of Nashua moving!	False
2020-08-12	1293619109180080128	RealDonaldTrump	Congrats to Pennsylvania for receiving $11.5M in federal infrastructure funds from @USDOT. Huge investments in Hazleton and Erie County to improve transit service and bring an economic boost to these areas!	False
2020-08-12	1293619078129692672	RealDonaldTrump	BIG bucks heading to Illinois! $18.9M in federal infrastructure funds from @USDOT will be awarded to @ConnectTransit, @CityLinkPeoria, and @PaceSuburbanBus for improvements to bus service in the areas. Congratulations!	False
2020-08-12	1293619029836468224	RealDonaldTrump	$13.9M is heading to New Orleans in @USDOT funding for @NewOrleansRTA! Happy to support bus service and major fleet improvements for the great people of Louisiana and help them keep moving safely.	False
2020-08-12	1293618992150720512	RealDonaldTrump	I’m awarding $14.7M in @USDOT funding to New Jersey to support bus infrastructure in @passaic_county. Helping make sure people can move quickly and safely!	False
2020-08-12	1293618947586248704	RealDonaldTrump	Happy to send $18 MILLION in @USDOT funding to Utah to support their transit infrastructure and improve bus service. Huge and badly needed investment in the Cache Valley Region!	False
2020-08-12	1293618908654645248	RealDonaldTrump	Bus investments are in the works for the people of Nebraska! I’m sending $13.6M from @USDOT in federal infrastructure funds for improvements to bus service in Omaha. Great news!	False
2020-08-12	1293618870746570756	RealDonaldTrump	Happy to announce that @USDOT is providing $12.5M in federal infrastructure funds for bus improvements for the great people of Alabama. @huntsvillecity	False
2020-08-12	1293618631943901185	RealDonaldTrump	Big news, Oklahoma! I’m proud to support infrastructure in your state with $13.7 million from @USDOT for bus improvements across the state. SO important for helping people get where they need to go safely.	False
2020-08-12	1293586660790239238	RealDonaldTrump	Congratulations to Andrew Clyde on a big win last night against a strong opponent in #GA09! An early supporter of ours, Andrew will be an incredible Congressman for the people of Georgia!	False
2020-08-12	1293525010523578375	RealDonaldTrump	Congratulations to future Republican Star Marjorie Taylor Greene on a big Congressional primary win in Georgia against a very tough and smart opponent. Marjorie is strong on everything and never gives up - a real WINNER!	False
2020-08-12	1293520377952567307	RealDonaldTrump	Watched @billmaher last week for the first time in a long time. He’s totally SHOT, looks terrible, exhausted, gaunt, and weak. If there was ever a good reason for no shutdown, check out this jerk. He never had much going for him, but whatever he did have is missing in action!	False
2020-08-12	1293517514798960640	RealDonaldTrump	The “suburban housewife” will be voting for me. They want safety &amp; are thrilled that I ended the long running program where low income housing would invade their neighborhood. Biden would reinstall it, in a bigger form, with Corey Booker in charge! @foxandfriends @MariaBartiromo	True
2020-08-12	1293513735533924352	RealDonaldTrump	96% Approval Rating in the Republican Party. Thank you! Also, leading in most swing states!	False
2020-08-12	1293510853074051073	RealDonaldTrump	.@KamalaHarris started strong in the Democrat Primaries, and finished weak, ultimately fleeing the race with almost zero support. That’s the kind of opponent everyone dreams of!	False
2020-08-12	1293368220498505728	RealDonaldTrump		False
2020-08-11	1293335445879820288	RealDonaldTrump	Sad to see the damage from the derecho in Midwest. 112 mile per hour winds in Midway, Iowa! The Federal government is in close coordination with State officials. We are with you all the way - Stay safe and strong!	False
2020-08-11	1293335144775004160	RealDonaldTrump	Thank you to Sheriff Gonzales of Bernalillo County, New Mexico, for joining my call with our Nation’s sheriffs. Appreciate your partnership to help make your county safe – great comments on Operation Legend! 	False
2020-08-11	1293314244008644609	RealDonaldTrump	Will be interviewed tonight on @seanhannity at 9:00 P.M. @FoxNews	False
2020-08-11	1293292784703672320	RealDonaldTrump	News Conference at 5:30 P.M. Enjoy!	False
2020-08-11	1293285949917495300	RealDonaldTrump		False
2020-08-11	1293163818282094594	RealDonaldTrump	Big Stock Market Numbers!	False
2020-08-11	1293163704188645385	RealDonaldTrump	More Testing, which is a good thing (we have the most in the world), equals more Cases, which is Fake News Gold. They use Cases to demean the incredible job being done by the great men &amp; women of the U.S. fighting the China Plague!	False
2020-08-11	1293151453029322753	RealDonaldTrump	John Bolton, one of the dumbest people I’ve met in government and sadly, I’ve met plenty, states often that I respected, and even trusted, Vladimir Putin of Russia more than those in our Intelligence Agencies. While of course that is not true, if the first people you met from....	False
2020-08-11	1293151454069391360	RealDonaldTrump	..so called American Intelligence were Dirty Cops who have now proven to be sleazebags at the highest level like James Comey, proven liar James Clapper, &amp; perhaps the lowest of them all, Wacko John Brennan who headed the CIA, you could perhaps understand my reluctance to embrace!	False
2020-08-11	1293141671509659650	RealDonaldTrump	Great new book by former Director of Oval Office Operations, Madeleine Westerhout, entitled “Off the Record”. When I look at all of the Fake Books and garbage written about me, it’s really nice to see a very smart and already wise young woman write an honest depiction of what....	False
2020-08-11	1293141672440877056	RealDonaldTrump	....went on at the White House during some extremely interesting and important times. So many good stories by someone who, unlike most other so called writers, was actually there, and a part of the action - of which there was plenty. Go buy this book, a job well done!	False
2020-08-10	1292964115003179008	RealDonaldTrump		False
2020-08-10	1292908143920455681	RealDonaldTrump	White House News Conference today at 5:30 P.M. Enjoy!	False
2020-08-10	1292886763690745859	RealDonaldTrump	Play College Football!	False
2020-08-10	1292880641311334400	RealDonaldTrump	Jason Lewis (@LewisForMN) will be an incredible Senator for the State of Minnesota! He is a proven leader who will help us Lower your Taxes, Protect our Communities and Defend your Second Amendment…	False
2020-08-10	1292880642276036608	RealDonaldTrump	...Jason worked with me to save Minneapolis along with your great National Guard after your local political leaders failed to do so. Jason has my Complete and Total Endorsement! #MNSEN 	False
2020-08-10	1292880134022795266	RealDonaldTrump	My friend, Congressman @TomEmmer, is doing a tremendous job for the people of Minnesota! He strongly supports our brave Law Enforcement &amp; National Guard, fights for our Vets and works hard to Cut your Taxes! Tom has my Complete and Total Endorsement! #MN06 	False
2020-08-10	1292880004183920641	RealDonaldTrump	Congressman @PeteStauber fights for the hard-working people of Northeastern Minnesota! A former professional hockey player, Pete knows how to win. He stands for Law Enforcement, Small Business and our Vets. Pete has my Complete and Total Endorsement! #MN08 	False
2020-08-10	1292879824210595842	RealDonaldTrump	Congressman Jim Hagedorn (@JimHagedornMN) is an incredible advocate for Minnesota! He fights for our Farmers, Vets and Small Businesses, and he strongly defends your Second Amendment! Jim has my Complete and Total Endorsement! #MN01 	False
2020-08-10	1292879715775250432	RealDonaldTrump	Congratulations on your big primary win, Governor @MikeParson! You have my Complete and Total Endorsement! #MOGOV 	False
2020-08-10	1292879622145814529	RealDonaldTrump	Vote for Michelle – a real winner! #MN07 	False
2020-08-10	1292877984488198147	RealDonaldTrump	CONGRATS to General Dynamic’s Bath Iron Works &amp; Local S6 on reaching a tentative agreement after the long strike. GD builds GREAT Arleigh-Burke destroyers. Super boost for Maine Economy. Glad to have helped. I’ve done a lot for Maine! 	False
2020-08-10	1292873531382992901	RealDonaldTrump	The student-athletes have been working too hard for their season to be cancelled. #WeWantToPlay 	False
2020-08-10	1292872318562205699	RealDonaldTrump	We have narrowed the Presidential Nomination Acceptance Speech, to be delivered on the final night of the Convention (Thursday), to two locations - The Great Battlefield of Gettysburg, Pennsylvania, and the White House, Washington, D.C. We will announce the decision soon!	False
2020-08-10	1292838130526158848	RealDonaldTrump	Thank you to Senator Bill Cassidy of Louisiana for his very smart words on the just signed Executive Orders!	False
2020-08-10	1292837084152107010	RealDonaldTrump	Portland, which is out of control, should finally, after almost 3 months, bring in the National Guard. The Mayor and Governor are putting people’s lives at risk. They will be held responsible. The Guard is ready to act immediately. The Courthouse is secured by Homeland!	False
2020-08-10	1292832946077007886	RealDonaldTrump	RINO Ben Sasse, who needed my support and endorsement in order to get the Republican nomination for Senate from the GREAT State of Nebraska, has, now that he’s got it (Thank you President T), gone rogue, again. This foolishness plays right into the hands of the Radical Left Dems!	False
2020-08-10	1292810574603202565	RealDonaldTrump	So now Schumer and Pelosi want to meet to make a deal. Amazing how it all works, isn’t it. Where have they been for the last 4 weeks when they were “hardliners”, and only wanted BAILOUT MONEY for Democrat run states and cities that are failing badly? They know my phone number!	False
2020-08-10	1292638186842337281	RealDonaldTrump	.@Scaramucci, who just made a fool of himself as he got taken apart by @SteveHiltonx, only lasted 11 days in his favorite of all time Administration, before being fired for, again, making a fool of himself. Anthony is a loser who begged to come back. I said “No Thanks”.	False
2020-08-10	1292628590425759747	RealDonaldTrump	This is Fake News by the failing @nytimes &amp; bad ratings @CNN. Never suggested it although, based on all of the many things accomplished during the first 3 1/2 years, perhaps more than any other Presidency, sounds like a good idea to me! 	False
2020-08-10	1292628551926263808	RealDonaldTrump		False
2020-08-08	1292239034966773761	RealDonaldTrump		False
2020-08-08	1292190319845478402	RealDonaldTrump	Major News Conference in Ten Minutes!	False
2020-08-08	1292181029541879812	RealDonaldTrump	Sleepy Joe Biden just agreed with the Radical Left Democrats to raise Taxes by Three Trillion Dollars. Everyone will pay - Will kill your Stocks, 401k’s, and the ECONOMY. BIG CRASH!  #MAGA	True
2020-08-07	1291871370197041152	RealDonaldTrump	Big wins in Tennessee and Kansas! Congratulations to @BillHagertyTN and @RogerMarshallMD. They love our Country and they love their Great States. Strong on Crime, Military, our Vets and the Second Amendment. They have my Complete and Total Endorsement!	False
2020-08-07	1291864911509938176	RealDonaldTrump	I will be doing a news conference on the ChinaVirus, the just announced very good economic numbers, and the improving economy, at 7pm from Bedminster, New Jersey. Also, the subject of the Beirut, Lebanon catastrophe will be discussed.	False
2020-08-07	1291864495648890881	RealDonaldTrump	...At 3pm this afternoon, spoke to President Aoun of Lebanon to inform him that 3 large aircraft are on the way, loaded up with Medical Supplies, Food and Water. Also, First Responders, Technicians, Doctors, and Nurses on the way...	False
2020-08-07	1291864496571666438	RealDonaldTrump	...We will be having a conference call on Sunday with President Macron, leaders of Lebanon, and leaders from various other parts of the world. Everyone wants to help!	False
2020-08-07	1291864494608732170	RealDonaldTrump	Had a lengthy discussion this morning with President Macron of France concerning numerous subjects, but in particular the catastrophic event which took place in Beirut, Lebanon...	False
2020-08-07	1291842540023558146	RealDonaldTrump	Pelosi and Schumer only interested in Bailout Money for poorly run Democrat cities and states. Nothing to do with China Virus! Want one trillion dollars. No interest. We are going a different way!	False
2020-08-07	1291749761511456768	RealDonaldTrump		False
2020-08-07	1291748179726209024	RealDonaldTrump		False
2020-08-07	1291732831102803968	RealDonaldTrump	Great Jobs Numbers!	False
2020-08-07	1291722355471941633	RealDonaldTrump	After yesterday’s statement, Sleepy Joe Biden is no longer worthy of the Black Vote!	True
2020-08-07	1291718731224305670	RealDonaldTrump	This is the biggest political crime and scandal in American history. Hopefully, for the good of our Country, it is coming soon! 	False
2020-08-07	1291718043261968385	RealDonaldTrump	Thank you! 	False
2020-08-07	1291717905239937026	RealDonaldTrump	Thank you! 	False
2020-08-07	1291714356485525506	RealDonaldTrump	Sleepy Joe Biden just lost the Black Vote. This statement is a disaster from which their is no recovery! 	True
2020-08-07	1291713214066184192	RealDonaldTrump	I called the politicization of the China Virus by the Radical Left Democrats a Hoax, not the China Virus itself. Everybody knows this except for the Fake and very Corrupt Media!	False
2020-08-07	1291535003466096641	RealDonaldTrump	 	False
2020-08-06	1291494244943908865	RealDonaldTrump	WE will WIN Ohio even bigger than we did in 2016 — MAGA is stronger than ever before! 	False
2020-08-06	1291443251803815948	RealDonaldTrump		False
2020-08-06	1291435765575176192	RealDonaldTrump	Just like Radical Left New York is trying to destroy the NRA, if Biden becomes President your GREAT SECOND AMENDMENT doesn’t have a chance. Your guns will be taken away, immediately and without notice. No police, no guns!	True
2020-08-06	1291421560658472960	RealDonaldTrump	Joe Biden: ‘Unlike the African American Community ... the Latino Community Is an Incredibly Diverse Community‘  via @BreitbartNews. Wow! Joe Biden just lost the entire African American community. What a “dumb” thing to say!	True
2020-08-06	1291416662059544576	RealDonaldTrump	Just departed for the Great State of Ohio! 	False
2020-08-06	1291402819287814145	RealDonaldTrump	Upon departing the Oval Office for Ohio, I’ve notified my staff to continue working on an Executive Order with respect to Payroll Tax Cut, Eviction Protections, Unemployment Extensions, and Student Loan Repayment Options.	False
2020-08-06	1291339436727382016	RealDonaldTrump	How can voters be sending in Ballots starting, in some cases, one month before the First Presidential Debate. Move the First Debate up. A debate, to me, is a Public Service. Joe Biden and I owe it to the American People!	True
2020-08-06	1291228757437579264	RealDonaldTrump	Two wonderful people! 	False
2020-08-06	1291224128427642882	RealDonaldTrump	Sally Yates is either lying or grossly incompetent. It is not possible she could have known so little about Dirty Cop James Comey (and others) from her high position in the Department of “Justice”. The political Crime of the Century, and she had no idea what they were doing?	False
2020-08-06	1291220257416282115	RealDonaldTrump	A very big CONGRATULATIONS to the great @seanhannity on having the Number One Book on the Planet, “Live Free Or Die”. The book is fantastic, and so true. Keep Sean Number One!	False
2020-08-06	1291166830946656259	RealDonaldTrump	“Cities across the Nation that are run by Democrats are in shambles.” Matt Walsh  @TuckerCarlson	False
2020-08-05	1291144294259200000	RealDonaldTrump	Congressman Scott DesJarlais (@tndesjarlais) has been a tremendous advocate for Tennessee! One of my earliest supporters, he fights for our Military, Vets, Law Enforcement and the Second Amendment! Scott has my Complete and Total Endorsement! #TN04 	False
2020-08-05	1291117659086561280	RealDonaldTrump	DRAIN THE SWAMP! 	False
2020-08-05	1291074236992323590	RealDonaldTrump	BIG NEWS! The Political Crime of the Century is unfolding. ObamaBiden illegally spied on the Trump Campaign, both before and after the election. Treason! 	True
2020-08-05	1291073985107693568	RealDonaldTrump	Every time you see a negative Big Pharma commercial against me remember, it means your drug prices are coming way down!	False
2020-08-05	1291061635348680704	RealDonaldTrump		False
2020-08-05	1291061529236905985	RealDonaldTrump		False
2020-08-05	1291061411167252483	RealDonaldTrump		False
2020-08-05	1291015075541786624	RealDonaldTrump	Sally Yates has zero credibility. She was a part of the greatest political crime of the Century, and ObamaBiden knew EVERYTHING! Sally Yates leaked the General Flynn conversation? Ask her under oath. Republicans should start playing the Democrats game!	True
2020-08-05	1291012543419482113	RealDonaldTrump	.@CNN has no sources on the Task Force. Their “sources” are made up, pure fiction! Jim Acosta is a Fake reporter!	False
2020-08-05	1290967953542909952	RealDonaldTrump	Nevada has ZERO infrastructure for Mail-In Voting. It will be a corrupt disaster if not ended by the Courts. It will take months, or years, to figure out. Florida has built a great infrastructure, over years, with two great Republican Governors. Florida, send in your Ballots!	False
2020-08-05	1290958442857926656	RealDonaldTrump	MAKE AMERICA GREAT AGAIN!	False
2020-08-05	1290957656321073152	RealDonaldTrump	I will be interviewed on @foxandfriends at 7:30 A.M. Enjoy!	False
2020-08-05	1290956691488612358	RealDonaldTrump	NASA was Closed &amp; Dead until I got it going again. Now it is the most vibrant place of its kind on the Planet...And we have Space Force to go along with it. We have accomplished more than any Administration in first 3 1/2 years. Sorry, but it all doesn’t happen with Sleepy Joe! 	True
2020-08-05	1290954271140216833	RealDonaldTrump	For those that thought I wasn’t into the Environment, this is the biggest bill ever passed, by far. I wonder if this will silence the Fake News? Probably not! 	False
2020-08-05	1290952940602130437	RealDonaldTrump	A great race run by Roger against a very tough and smart opponent. Roger loves Kansas and will represent it incredibly well. He has my Complete and Total Endorsement. Will be a Big Win on November 3rd. This is not the opponent the Democrats wanted! 	False
2020-08-05	1290949993600294913	RealDonaldTrump	There is TREMENDOUS Lawlessness in America’s Liberal Cities. Would be so easy to stop but they have a clouded vision of what should be done. They are indoctrinated with a philosophy which will never work, a philosophy which would destroy America. Portland would be the norm!	False
2020-08-04	1290794273261133824	RealDonaldTrump		False
2020-08-04	1290784892469555201	RealDonaldTrump	Great meeting today with the CoronaVirus Task Force in the Oval Office. Stay informed at: . 	False
2020-08-04	1290741980813824005	RealDonaldTrump	THE WALL STREET JOURNAL  “Trump Wins in Portland”  “Something big has changed in Portland, Ore. After weeks of chaos and flames outside the city’s federal courthouse, the past few days have seen the violence subside dramatically. What happened?” William McGurn @WSJ	False
2020-08-04	1290730748132167681	RealDonaldTrump	I am deeply saddened by the tragic loss of eight Marines and one Sailor during a training exercise off the coast of California. Our prayers are with their families. I thank them for the brave service their loved ones gave to our Nation. #SemperFidelis	False
2020-08-04	1290727631114166272	RealDonaldTrump	Today we celebrated the passage of landmark legislation that will preserve America’s majestic natural wonders, priceless historic treasures, grand national monuments, and glorious national parks. It was my great honor to sign the Great American Outdoors Act into law! #HR1957 	False
2020-08-04	1290692768675901440	RealDonaldTrump	Whether you call it Vote by Mail or Absentee Voting, in Florida the election system is Safe and Secure, Tried and True. Florida’s Voting system has been cleaned up (we defeated Democrats attempts at change), so in Florida I encourage all to request a Ballot &amp; Vote by Mail! #MAGA	False
2020-08-04	1290687393293631489	RealDonaldTrump		False
2020-08-04	1290648990242004992	RealDonaldTrump	Big Pharma is taking ads against me because I am MASSIVELY lowering your drug prices, which is obviously not good for them. Medicare premiums will also be going down. I am the first President to take them on. Don’t fall for their false ads. Biden plan is for very big increases!	True
2020-08-04	1290638211354693632	RealDonaldTrump	Happy 230th Birthday @USCG!!  	False
2020-08-04	1290623558461411333	RealDonaldTrump	People are not happy that players are not standing for our National Anthem!	False
2020-08-04	1290488364362170371	RealDonaldTrump	OPEN THE SCHOOLS!!!	False
2020-08-03	1290308363872538624	RealDonaldTrump	My visits last week to Texas and Florida had massive numbers of cheering people gathered along the roads and highways, thousands and thousands, even bigger (by far) than the crowds of 2016. Saw no Biden supporters, and yet some in the Fake News said it was an equal number. Sad!	True
2020-08-03	1290283634130214913	RealDonaldTrump	RECORD HIGH NASDAQ! It would all come crashing down, including your Jobs, Stocks, and 401k’s, if Sleepy Joe ever became President. China and others would own us!!!	True
2020-08-03	1290282508303716352	RealDonaldTrump	So Crazy Nancy Pelosi said horrible things about Dr. Deborah Birx, going after her because she was too positive on the very good job we are doing on combatting the China Virus, including Vaccines &amp; Therapeutics. In order to counter Nancy, Deborah took the bait &amp; hit us. Pathetic!	False
2020-08-03	1290270589945430016	RealDonaldTrump	Wow! Really bad TV Ratings for Morning Joe (@JoeNBC). @foxandfriends doing great, leading all others by far. @CNN not a factor!!!	True
2020-08-03	1290267685117460481	RealDonaldTrump	My visits last week to Texas and Frorida had massive numbers of cheering people gathered along the roads and highways, thousands and thousands, even bigger (by far) than the crowds of 2016. Saw no Biden supporters, and yet some in the Fake News said it was an equal number. Sad!	True
2020-08-03	1290261807282757632	RealDonaldTrump	96% Approval Rating in the Republican Party. 50% in new Rasmussen Poll (higher than Obama at this point in time). Thank you!	False
2020-08-03	1290257055534551043	RealDonaldTrump	Cases up because of BIG Testing! Much of our Country is doing very well. Open the Schools!	False
2020-08-03	1290253369404092417	RealDonaldTrump	FAKE NEWS IS THE ENEMY OF THE PEOPLE!	False
2020-08-03	1290252674777133057	RealDonaldTrump	With the exception of New York &amp; a few other locations, we’ve done MUCH better than most other Countries in dealing with the China Virus. Many of these countries are now having a major second wave. The Fake News is working overtime to make the USA (&amp; me) look as bad as possible!	False
2020-08-03	1290250416278532096	RealDonaldTrump	In an illegal late night coup, Nevada’s clubhouse Governor made it impossible for Republicans to win the state. Post Office could never handle the Traffic of Mail-In Votes without preparation. Using Covid to steal the state. See you in Court! 	False
2020-08-03	1290097359204913152	RealDonaldTrump		False
