date	id	username	text	opponent_mentioned
2020-06-03	1267985990465064962	RealDonaldTrump	...then tell them they will not be able to gain entry. Governor Cooper is still in Shelter-In-Place Mode, and not allowing us to occupy the arena as originally anticipated and promised. Would have showcased beautiful North Carolina to the World, and brought in hundreds of...	False
2020-06-03	1267973369351360517	RealDonaldTrump	“Media Falsely Claimed Violent Riots Were Peaceful And That Tear Gas Was Used Against Rioters” 	False
2020-06-02	1267959729361485825	RealDonaldTrump	Washington, D.C., was the safest place on earth last night!	False
2020-06-02	1267907954537312256	RealDonaldTrump	Sleepy Joe has been in politics for 40 years, and did nothing. Now he pretends to have the answers. He doesn’t even know the questions. Weakness will never beat anarchists, looters or thugs, and Joe has been politically weak all of his life. LAW &amp; ORDER!	True
2020-06-02	1267906686825742337	RealDonaldTrump		False
2020-06-02	1267903423954980864	RealDonaldTrump	Macy’s at 34th. Street, long the largest single department store anywhere in the world, &amp; a point of pride in NYC, was devastated yesterday when hoodlums and thieves vandalized it, breaking almost all of its large panels of storefront glass. What a shame. Bring in National Guard!	False
2020-06-02	1267885679175970821	RealDonaldTrump	...AND THE BEST IS YET TO COME!	False
2020-06-02	1267885675338219520	RealDonaldTrump	My Admin has done more for the Black Community than any President since Abraham Lincoln. Passed Opportunity Zones with @SenatorTimScott, guaranteed funding for HBCU’s, School Choice, passed Criminal Justice Reform, lowest Black unemployment, poverty, and crime rates in history…	False
2020-06-02	1267879823717945344	RealDonaldTrump	Decorated combat Vet @MarthaMcSally has a great new book, Dare to Fly, which tells her story as the first American woman to fly a fighter jet in combat. She’s tough, tested, and true. A real fighter for Arizona. Get her book today at !	False
2020-06-02	1267873393275219972	RealDonaldTrump	Great new book out today by @DineshDSouza — get your copy today! 	False
2020-06-02	1267851534454476800	RealDonaldTrump	New York City put on an 11:00 P.M. CURFEW last night. No wonder they ripped the place apart. Should be 7:00 P.M. CALL UP THE NATIONAL GUARD. #SAVENYC	False
2020-06-02	1267838101340196866	RealDonaldTrump	SILENT MAJORITY!	False
2020-06-02	1267835873405665282	RealDonaldTrump	NYC, CALL UP THE NATIONAL GUARD. The lowlifes and losers are ripping you apart. Act fast! Don’t make the same horrible and deadly mistake you made with the Nursing Homes!!!	False
2020-06-02	1267828812244381698	RealDonaldTrump	Republicans, get out and vote today for those great candidates that will lead to big victories on November 3rd. MAKE AMERICA GREAT AGAIN!	False
2020-06-02	1267826457796984832	RealDonaldTrump	Vaccines are coming along really well. Likewise therapeutics. Moving faster than anticipated. Good news ahead (in many ways)!	False
2020-06-02	1267811637811187712	RealDonaldTrump	Yesterday was a bad day for the Cuomo Brothers. New York was lost to the looters, thugs, Radical Left, and all others forms of Lowlife &amp; Scum. The Governor refuses to accept my offer of a dominating National Guard. NYC was ripped to pieces. Likewise, Fredo’s ratings are down 50%!	False
2020-06-02	1267810311328980998	RealDonaldTrump	Chris Jacobs (@JacobsNY27) will be a tremendous Congressman who will always fight for New York. He is Strong on the Border, our Military and Vets, and the Second Amendment. Chris has my Complete and Total Endorsement! Vote for Chris on June 23! #NY27 	False
2020-06-02	1267809888383705088	RealDonaldTrump	Congressman Dusty Johnson (@DustyJohnson) is a phenomenal advocate for the people of South Dakota! He helped us deliver USMCA for our Farmers, and he is strong on the Border and our Second Amendment. Dusty has my Complete and Total Endorsement! #SDAL 	False
2020-06-02	1267809766627315712	RealDonaldTrump	Senator Mike Rounds (@RoundsforSenate) continues to deliver for South Dakota! Mike is working hard for our incredible Farmers and he is strong on Trade, Military, our Vets, and the Second Amendment. Mike has my Complete and Total Endorsement! #SDSen 	False
2020-06-02	1267809721458753537	RealDonaldTrump	Congressman Mike Simpson (@MikeSimpson4ID) is a tremendous champion for Idaho! Mike is working hard for our incredible Farmers, and he strongly supports our Military, Vets and the Second Amendment. Mike has my Complete and Total Endorsement! #ID02  	False
2020-06-02	1267809685685460997	RealDonaldTrump	Congressman Russ Fulcher (@RussFulcher) is an incredible Representative for the people of Idaho! He fully supports the Border Wall, Life, our Vets and the Second Amendment. Russ has my Complete and Total Endorsement! #ID01	False
2020-06-02	1267809644887658498	RealDonaldTrump	Congressman Greg Pence (@GregPenceIN) is doing a phenomenal job for Indiana. His brother, our great Vice President Mike Pence, and I need Greg to help us keep our Country SAFE and fight for our #MAGA agenda. Greg has my Complete &amp; Total Endorsement! #IN06 	False
2020-06-02	1267809602458042371	RealDonaldTrump	Congressman Jim Banks (@jim_banks) is a fighter for Indiana! A highly respected Navy Officer, Jim works hard for our Vets and Small Businesses. Strongly supports the Second Amendment and our Border Wall! Jim has my Complete and Total Endorsement! #IN03 	False
2020-06-02	1267809452020948999	RealDonaldTrump	Congresswoman Jackie Walorski (@jackiewalorski) is doing an incredible job for Indiana. She fights for Small Businesses, the Economy, and our incredible Military and Vets! Jackie has my Complete and Total Endorsement! #IN02	False
2020-06-02	1267809400267431939	RealDonaldTrump	Congressman Andy Harris (@Harris4Congress) is a tremendous advocate for Maryland! A highly respected physician, Andy fights for the Second Amendment, Border Security and our incredible Farmers. Andy has my Complete and Total Endorsement! #MD01 	False
2020-06-02	1267808120136511489	RealDonaldTrump	D.C. had no problems last night. Many arrests. Great job done by all. Overwhelming force. Domination. Likewise, Minneapolis was great (thank you President Trump!).	False
2020-06-02	1267667526382747657	RealDonaldTrump	Thank you Mark! 	False
2020-06-02	1267666558178004992	RealDonaldTrump	Fake News. Couldn’t hear them during speech! 	False
2020-06-02	1267656369475399686	RealDonaldTrump	Can’t let this happen! 	False
2020-06-02	1267654339209953285	RealDonaldTrump	Great! 	False
2020-06-02	1267634481877454849	RealDonaldTrump	YES! 	False
2020-06-02	1267609190140436481	RealDonaldTrump	My fellow Americans - My first and highest duty as President is to defend our great Country and the American People. I swore an oath to uphold the laws of our Nation -- and that is exactly what I will do… 	False
2020-06-01	1267580557141184513	RealDonaldTrump	I will be delivering brief remarks from the Rose Garden at 6:30 P.M. Eastern to update on the Federal Response.	False
2020-06-01	1267522468400562183	RealDonaldTrump	100% Correct. Thank you Tom! 	False
2020-06-01	1267515702652678144	RealDonaldTrump	Anarchists, we see you! 	False
2020-06-01	1267448029738606593	RealDonaldTrump	“Trump” is leading in all swing states. Heavily biased Democrat Poll, just like 2016. Biggest “enthusiasm” lead ever! 	False
2020-06-01	1267445910826627078	RealDonaldTrump	Sleepy Joe Biden’s people are so Radical Left that they are working to get the Anarchists out of jail, and probably more. Joe doesn’t know anything about it, he is clueless, but they will be the real power, not Joe. They will be calling the shots! Big tax increases for all, Plus!	True
2020-06-01	1267437132240441344	RealDonaldTrump	NOVEMBER 3RD.	False
2020-06-01	1267436848957272064	RealDonaldTrump	Sleep Joe Biden’s people are so Radical Left that they are working to get the Anarchists out of jail, and probably more. Joe doesn’t know anything about it, he is clueless, but they will be the real power, not Joe. They will be calling the shots! Big tax increases for all, Plus!	True
2020-06-01	1267432507005448192	RealDonaldTrump	“These were the people that trashed Seattle years ago. Who’s paying for these people. I was appalled that 13 of Joe Biden’s staff were donating money to bail people out in Minneapolis. They should have stayed in jail until this is over (and beyond).” @newtgingrich @foxandfriends	True
2020-06-01	1267430825659899907	RealDonaldTrump	“I don’t see any indication that there were any white supremest groups mixing in. This is an ANTIFA Organization. It seems that the first time we saw it in a major way was Occupy Wall Street. It’s the same mindset.” @kilmeade  @foxandfriends  TRUE!	False
2020-06-01	1267246821597941764	RealDonaldTrump	FAKE NEWS!	False
2020-05-31	1267227396341669889	RealDonaldTrump	LAW &amp; ORDER!	False
2020-05-31	1267216497686056960	RealDonaldTrump	Our National Guard stopped them cold last night. Should have been called up sooner! 	False
2020-05-31	1267197835067502592	RealDonaldTrump	SO TERRIBLE! Where are the arrests and LONG TERM jail sentences? 	False
2020-05-31	1267189270353186821	RealDonaldTrump	STRENGTH! 	False
2020-05-31	1267187902192193538	RealDonaldTrump	Get tough Democrat Mayors and Governors. These people are ANARCHISTS. Call in our National Guard NOW. The World is watching and laughing at you and Sleepy Joe. Is this what America wants? NO!!!	True
2020-05-31	1267185107980496896	RealDonaldTrump	Law &amp; Order in Philadelphia, NOW! They are looting stores. Call in our great National Guard like they FINALLY did (thank you President Trump) last night in Minneapolis. Is this what voters want with Sleepy Joe? All Dems!	True
2020-05-31	1267132763116838913	RealDonaldTrump	The Lamestream Media is doing everything within their power to foment hatred and anarchy. As long as everybody understands what they are doing, that they are FAKE NEWS and truly bad people with a sick agenda, we can easily work through them to GREATNESS!	False
2020-05-31	1267129644228247552	RealDonaldTrump	The United States of America will be designating ANTIFA as a Terrorist Organization.	False
2020-05-31	1267126801186394118	RealDonaldTrump	Other Democrat run Cities and States should look at the total shutdown of Radical Left Anarchists in Minneapolis last night. The National Guard did a great job, and should be used in other States before it is too late!	False
2020-05-31	1267124501361369091	RealDonaldTrump	Congratulations to our National Guard for the great job they did immediately upon arriving in Minneapolis, Minnesota, last night. The ANTIFA led anarchists, among others, were shut down quickly. Should have been done by Mayor on first night and there would have been no trouble!	False
2020-05-31	1266915358914621440	RealDonaldTrump	Let New York’s Finest be New York’s Finest. There is nobody better, but they must be allowed to do their job!	False
2020-05-31	1266914470066036736	RealDonaldTrump	The National Guard has been released in Minneapolis to do the job that the Democrat Mayor couldn’t do. Should have been used 2 days ago &amp; there would not have been damage &amp; Police Headquarters would not have been taken over &amp; ruined. Great job by the National Guard. No games!	False
2020-05-31	1266895821083234304	RealDonaldTrump		False
2020-05-31	1266887324505382912	RealDonaldTrump	MN Gov. Walz: We Estimate 80% of the Rioters Are from out of State  via @BreitbartNews	False
2020-05-30	1266800827621990400	RealDonaldTrump	Hopefully a great, successful and safe ROCKET LAUNCH. Lifting off soon!?!?  @FoxNews  @OANN	False
2020-05-30	1266800113260703744	RealDonaldTrump	80% of the RIOTERS in Minneapolis last night were from OUT OF STATE. They are harming businesses (especially African American small businesses), homes, and the community of good, hardworking Minneapolis residents who want peace, equality, and to provide for their families.	False
2020-05-30	1266799941273350145	RealDonaldTrump	Much more “disinformation” coming out of CNN, MSDNC, @nytimes and @washingtonpost, by far, than coming out of any foreign country, even combined. Fake News is the Enemy of the People!	False
2020-05-30	1266796670609588225	RealDonaldTrump	Crossing State lines to incite violence is a FEDERAL CRIME! Liberal Governors and Mayors must get MUCH tougher or the Federal Government will step in and do what has to be done, and that includes using the unlimited power of our Military and many arrests. Thank you!	False
2020-05-30	1266777430016102403	RealDonaldTrump	Here we go again. Fake News @CNN is blaming RUSSIA, RUSSIA, RUSSIA. They are sick losers with VERY bad ratings! P.S. Can’t blame China because they need the cash?	False
2020-05-30	1266760009872007171	RealDonaldTrump	It’s ANTIFA and the Radical Left. Don’t lay the blame on others!	False
2020-05-30	1266737385120960515	RealDonaldTrump	Mayor Jacob Frey of Minneapolis will never be mistaken for the late, great General Douglas McArthur or great fighter General George Patton. How come all of these places that defend so poorly are run by Liberal Democrats? Get tough and fight (and arrest the bad ones). STRENGTH!	False
2020-05-30	1266731291917062145	RealDonaldTrump	These are “Organized Groups” that have nothing to do with George Floyd. Sad!	False
2020-05-30	1266724553620930561	RealDonaldTrump	The professionally managed so-called “protesters” at the White House had little to do with the memory of George Floyd. They were just there to cause trouble. The @SecretService handled them easily. Tonight, I understand, is MAGA NIGHT AT THE WHITE HOUSE???	False
2020-05-30	1266722977242124288	RealDonaldTrump	They professionally managed so-called “protesters” at the White House had little to do with the memory of George Floyd. They were just there to cause trouble. The @SecretService handled them easily. Tonight, I understand, is MAGA NIGHT AT THE WHITE HOUSE???	False
2020-05-30	1266721357712232448	RealDonaldTrump	They professionally managed so-called “protesters” at the White House had little to do with the memory of George Floyd. They were just their to cause trouble. The @SecretService handled them easily. Tonight, I understand, is MAGA NIGHT AT THE WHITE HOUSE???	False
2020-05-30	1266711221191020544	RealDonaldTrump	Great job last night at the White House by the U.S. @SecretService. They were not only totally professional, but very cool. I was inside, watched every move, and couldn’t have felt more safe. They let the “protesters” scream &amp; rant as much as they wanted, but whenever someone....	False
2020-05-30	1266711221836931072	RealDonaldTrump	....got too frisky or out of line, they would quickly come down on them, hard - didn’t know what hit them. The front line was replaced with fresh agents, like magic. Big crowd, professionally organized, but nobody came close to breaching the fence. If they had they would....	False
2020-05-30	1266711223657205763	RealDonaldTrump	....have been greeted with the most vicious dogs, and most ominous weapons, I have ever seen. That’s when people would have been really badly hurt, at least. Many Secret Service agents just waiting for action. “We put the young ones on the front line, sir, they love it, and....	False
2020-05-30	1266711224391213056	RealDonaldTrump	....good practice.” As you saw last night, they were very cool &amp; very professional. Never let it get out of hand. Thank you! On the bad side, the D.C. Mayor, @MurielBowser, who is always looking for money &amp; help, wouldn’t let the D.C. Police get involved. “Not their job.” Nice!	False
2020-05-30	1266570099454103553	RealDonaldTrump	Time for a change! #2020 	False
2020-05-29	1266455834457968640	RealDonaldTrump		False
2020-05-29	1266434153932894208	RealDonaldTrump	Looting leads to shooting, and that’s why a man was shot and killed in Minneapolis on Wednesday night - or look at what just happened in Louisville with 7 people shot. I don’t want this to happen, and that’s what the expression put out last night means....	False
2020-05-29	1266434155543506945	RealDonaldTrump	....It was spoken as a fact, not as a statement. It’s very simple, nobody should have any problem with this other than the haters, and those looking to cause trouble on social media. Honor the memory of George Floyd!	False
2020-05-29	1266387743996870656	RealDonaldTrump	REVOKE 230!	False
2020-05-29	1266380510344949761	RealDonaldTrump	The National Guard has arrived on the scene. They are in Minneapolis and fully prepared. George Floyd will not have died in vain. Respect his memory!!!	False
2020-05-29	1266379480890773505	RealDonaldTrump	The National Guard has been activated In Minneapolis. They have arrived on the seen. George Floyd will not have died in vain. Respect his memory!!!	False
2020-05-29	1266354084036194306	RealDonaldTrump	CHINA!	False
2020-05-29	1266349790507515905	RealDonaldTrump	“Regulate Twitter if they are going to start regulating free speech.” @JudgeJeanine @foxandfriends  Well, as they have just proven conclusively, that’s what they are doing. Repeal Section 230!!!	False
2020-05-29	1266346957611708417	RealDonaldTrump	“The President has been targeted by Twitter.” @MariaBartiromo  What about all of the lies and fraudulent statements made by Adam Schiff, and so many others, on the Russian Witch Hunt Plus, Plus, Plus? What about China’s propaganda? WHO’s mistakes? No flags?  @foxandfriends	False
2020-05-29	1266326065833824257	RealDonaldTrump	Twitter is doing nothing about all of the lies &amp; propaganda being put out by China or the Radical Left Democrat Party. They have targeted Republicans, Conservatives &amp; the President of the United States. Section 230 should be revoked by Congress. Until then, it will be regulated!	False
2020-05-29	1266231100780744704	RealDonaldTrump	....These THUGS are dishonoring the memory of George Floyd, and I won’t let that happen. Just spoke to Governor Tim Walz and told him that the Military is with him all the way. Any difficulty and we will assume control but, when the looting starts, the shooting starts. Thank you!	False
2020-05-29	1266231100172615680	RealDonaldTrump	I can’t stand back &amp; watch this happen to a great American City, Minneapolis. A total lack of leadership. Either the very weak Radical Left Mayor, Jacob Frey, get his act together and bring the City under control, or I will send in the National Guard &amp; get the job done right.....	False
2020-05-29	1266172570983940101	RealDonaldTrump	MAIL-IN VOTING WILL LEAD TO MASSIVE FRAUD AND ABUSE. IT WILL ALSO LEAD TO THE END OF OUR GREAT REPUBLICAN PARTY. WE CAN NEVER LET THIS TRAGEDY BEFALL OUR NATION. BIG MAIL-IN VICTORY IN TEXAS COURT TODAY. CONGRATS!!!	False
2020-05-29	1266169633016631297	RealDonaldTrump	.@Facebook CEO Mark Zuckerberg is today criticizing Twitter. “We have a different policy than Twitter on this. I believe strongly that Facebook shouldn’t be the arbiter of truth of everything that people say online.” Did Twitter criticize Obama for his “you can keep your Dr.”?	False
2020-05-29	1266166078260097029	RealDonaldTrump		False
2020-05-29	1266158949763604481	RealDonaldTrump		False
2020-05-28	1266139770050183169	RealDonaldTrump		False
2020-05-28	1266132013679067136	RealDonaldTrump	I’m proud to commit $40.9M in @USDOT funding to Milwaukee’s East-West Bus Rapid Transit project. Bringing modern transit to the region’s most critical corridor and spur millions in economic development. Love Wisconsin! @RideMCTS	False
2020-05-28	1266131862633811968	RealDonaldTrump	Ogden, Utah, I am committing $64.5M to build bus service between Weber State University and McKay-Dee Hospital—very important services for Utahans! @RideUTA	False
2020-05-28	1266131774477828097	RealDonaldTrump	.@USDOT is committing $99.95M to @PGHtransit in Pennsylvania to connect Pittsburghers to their two largest commercial employment centers through safe, quick transit service. Great things coming to a great State!	False
2020-05-28	1266131624812576768	RealDonaldTrump	MAX Red line in Oregon is set to receive $99.99M in @USDOT funds to reduce delays in the Portland area, connect citizens to very important locations, and make transit GREAT! @trimet	False
2020-05-28	1266131411326701574	RealDonaldTrump	I am proud to commit $60.9M in @USDOT funding to provide a BRAND NEW bus system for a very busy and popular transit corridor in the Albany, NY area—more help coming to the people of New York! @CDTA	False
2020-05-28	1266131311699378176	RealDonaldTrump	Indiana is set to receive $100M in @USDOT transit funds for the @southshoreline to connect people to jobs around the State and the Chicago-area and help cut down on traffic. @GovHolcomb has worked very hard on this project!	False
2020-05-28	1266131083566825472	RealDonaldTrump	Big announcement for the State of Indiana! $77.5M committed in @USDOT funds for a “game-changing” transit project to provide fast and frequent service to the people of Indianapolis and Lawrence.	False
2020-05-28	1266130942957162500	RealDonaldTrump	I’m excited to commit $100M to @MiamiDadeCounty, FL in @USDOT funding to connect fast-growing communities through state-of-the-art transit service! Fast, safe, and beautiful infrastructure!	False
2020-05-28	1266123052372328449	RealDonaldTrump	.@USDOT is committing $21.8M for the FIRST transit project of this kind in the Tampa Bay region. It will connect St. Petersburg to popular beaches through state-of-the-art transit buses with FREE WiFi. Will be a major help to heavily populated parts of the Great State of Florida!	False
2020-05-28	1266122849225506819	RealDonaldTrump	Very exciting news for the Phoenix area—@USDOT is committing $100M to @valleymetro for a 5.5-mile light rail system with 9 new stations connecting underserved areas to churches, emergency services, and more!	False
2020-05-28	1266114309811249153	RealDonaldTrump		False
2020-05-28	1266114258951188482	RealDonaldTrump		False
2020-05-28	1266047584038256640	RealDonaldTrump	So ridiculous to see Twitter trying to make the case that Mail-In Ballots are not subject to FRAUD. How stupid, there are examples, &amp; cases, all over the place. Our election process will become badly tainted &amp; a laughingstock all over the World. Tell that to your hater @yoyoel	False
2020-05-28	1266041589455077381	RealDonaldTrump	The men and women of the National Guard have been doing a great job fighting the CoronaVirus. This week, I will extend their Title 32 orders through mid-August, so they can continue to help States succeed in their response and recovery efforts.	False
2020-05-28	1266017512162037761	RealDonaldTrump	Thank you to our GREAT Republican Congressmen &amp; Congresswomen on your incredibly important blockage last night of a FISA Bill that would just perpetuate the abuse that produced the Greatest Political Crime In the History of the U.S., the Russian Witch-Hunt. Fantastic Job!	False
2020-05-28	1266014911127306240	RealDonaldTrump	All over the World the CoronaVirus, a very bad “gift” from China, marches on. Not good!	False
2020-05-28	1266000762057953284	RealDonaldTrump	We have just reached a very sad milestone with the coronavirus pandemic deaths reaching 100,000. To all of the families &amp; friends of those who have passed, I want to extend my heartfelt sympathy &amp; love for everything that these great people stood for &amp; represent. God be with you!	False
2020-05-28	1265985660898459655	RealDonaldTrump	This will be a Big Day for Social Media and FAIRNESS!	False
2020-05-28	1265980172739719170	RealDonaldTrump	So many different viewpoints! 	False
2020-05-28	1265978466039746560	RealDonaldTrump	@USAttyHuber Whatever happen to John Huber?	False
2020-05-28	1265976095209373696	RealDonaldTrump	The greatest political crime in USA History! 	False
2020-05-28	1265975549954076672	RealDonaldTrump	Yet she doesn’t let people even breath in Michigan. A very bad double standard! 	False
2020-05-28	1265974350991278080	RealDonaldTrump	Trump on Russia Hoax: ‘When the Papers Come Out’ We Will Learn Obama ‘Knew Everything’ 	False
2020-05-28	1265855459719892993	RealDonaldTrump	Thank you Cowboys. See you in New Mexico! 	False
2020-05-28	1265851644736081921	RealDonaldTrump	He looks better! 	False
2020-05-28	1265842102266626049	RealDonaldTrump	Thank you Lou! 	False
2020-05-28	1265834167272603649	RealDonaldTrump	Who else gave the less than elite (We are the elite. We know how to WIN!) 260 great new Federal Judges, 2 SCJ’s, Low Taxes, biggest ever REG. CUTS, Rebuilt Military, Choice, saved 2A &amp; MUCH more? Not Sleepy Joe! Thank you Erick. 	True
2020-05-28	1265827032707072000	RealDonaldTrump	Texas Supreme Court: Lack of immunity to COVID-19 alone not enough to vote by mail   Big win in Texas on the dangerous Mail In Voting Scam!	False
2020-05-28	1265819308699070464	RealDonaldTrump	Big Tech is doing everything in their very considerable power to CENSOR in advance of the 2020 Election. If that happens, we no longer have our freedom. I will never let it happen! They tried hard in 2016, and lost. Now they are going absolutely CRAZY. Stay Tuned!!!	False
2020-05-27	1265792961612320769	RealDonaldTrump		False
2020-05-27	1265790356379054080	RealDonaldTrump		False
2020-05-27	1265779391646187520	RealDonaldTrump	"""He is arguably the greatest president in our history.” Thank you @LouDobbs! "	False
2020-05-27	1265774767493148672	RealDonaldTrump	At my request, the FBI and the Department of Justice are already well into an investigation as to the very sad and tragic death in Minnesota of George Floyd....	False
2020-05-27	1265774770877902848	RealDonaldTrump	....I have asked for this investigation to be expedited and greatly appreciate all of the work done by local law enforcement. My heart goes out to George’s family and friends. Justice will be served!	False
